[
  {
    "id": "9c9e159d-b8ea-44fa-aa82-713ee07e1ac5",
    "schema_version": "1.0.0",
    "idempotency_key": "fixture-approval-1-create",
    "status": "DRAFT",
    "version": 1,
    "created_at": "2026-07-31T09:00:00Z",
    "updated_at": "2026-07-31T09:00:00Z",
    "created_by_role": "PHASE_OWNER",
    "gated_category": "GC-02",
    "entity_type": "product",
    "entity_id": "5907a1a4-3740-4675-9079-e59e9eb91c8e",
    "summary": "fixture-approval-summary-1: a structural placeholder for a one-sentence approval request.",
    "effect_if_approved": "fixture-approval-effect-1: a structural placeholder for the concrete external-facing effect.",
    "reversal_cost": "fixture-approval-reversal-cost-1: a structural placeholder describing how hard this is to undo.",
    "artifact_digest": "fixture-artifact-digest-1",
    "requested_by_role": null,
    "requested_at": null,
    "decided_by_role": null,
    "decided_at": null
  },
  {
    "id": "b0f19883-430c-4e02-abed-aaa8f1570c18",
    "schema_version": "1.0.0",
    "idempotency_key": "fixture-approval-2-create",
    "status": "PENDING_APPROVAL",
    "version": 2,
    "created_at": "2026-07-31T09:00:00Z",
    "updated_at": "2026-07-31T09:15:00Z",
    "created_by_role": "PHASE_OWNER",
    "gated_category": "GC-01",
    "entity_type": "content",
    "entity_id": "6991ff73-2f21-4567-9f25-4cd605185a93",
    "summary": "fixture-approval-summary-2: a structural placeholder for a one-sentence approval request.",
    "effect_if_approved": "fixture-approval-effect-2: a structural placeholder for the concrete external-facing effect.",
    "reversal_cost": "fixture-approval-reversal-cost-2: a structural placeholder describing how hard this is to undo.",
    "artifact_digest": "fixture-artifact-digest-2",
    "requested_by_role": "PHASE_OWNER",
    "requested_at": "2026-07-31T09:15:00Z",
    "decided_by_role": null,
    "decided_at": null
  },
  {
    "id": "952fa32b-e3fd-4fb3-8543-aa0612d9428b",
    "schema_version": "1.0.0",
    "idempotency_key": "fixture-approval-3-create",
    "status": "APPROVED",
    "version": 3,
    "created_at": "2026-07-15T09:00:00Z",
    "updated_at": "2026-07-16T09:00:00Z",
    "created_by_role": "PHASE_OWNER",
    "gated_category": "GC-07",
    "entity_type": "campaign",
    "entity_id": "e1e7f3fe-68cc-4905-9d0f-421fda96a606",
    "summary": "fixture-approval-summary-3: a structural placeholder for a one-sentence approval request.",
    "effect_if_approved": "fixture-approval-effect-3: a structural placeholder for the concrete external-facing effect.",
    "reversal_cost": "fixture-approval-reversal-cost-3: a structural placeholder describing how hard this is to undo.",
    "artifact_digest": "fixture-artifact-digest-3",
    "requested_by_role": "PHASE_OWNER",
    "requested_at": "2026-07-15T12:00:00Z",
    "decided_by_role": "PROJECT_OWNER",
    "decided_at": "2026-07-16T09:00:00Z"
  },
  {
    "id": "26f2f0a1-6b1f-4a6b-8a6b-1a2b3c4d5e6f",
    "schema_version": "1.0.0",
    "idempotency_key": "fixture-approval-4-create",
    "status": "WITHDRAWN",
    "version": 2,
    "created_at": "2026-07-29T09:00:00Z",
    "updated_at": "2026-07-29T10:00:00Z",
    "created_by_role": "PHASE_OWNER",
    "gated_category": "GC-06",
    "entity_type": null,
    "entity_id": null,
    "summary": "fixture-approval-summary-4: a structural placeholder for a one-sentence approval request withdrawn before submission.",
    "effect_if_approved": "fixture-approval-effect-4: a structural placeholder for the concrete external-facing effect.",
    "reversal_cost": "fixture-approval-reversal-cost-4: a structural placeholder describing how hard this is to undo.",
    "artifact_digest": "fixture-artifact-digest-4",
    "requested_by_role": null,
    "requested_at": null,
    "decided_by_role": "PHASE_OWNER",
    "decided_at": "2026-07-29T10:00:00Z"
  },
  {
    "id": "5b6c7d8e-9f0a-4b1c-8d2e-3f4a5b6c7d8e",
    "schema_version": "1.0.0",
    "idempotency_key": "fixture-approval-5-create",
    "status": "EXPIRED",
    "version": 3,
    "created_at": "2026-06-01T09:00:00Z",
    "updated_at": "2026-06-30T09:00:00Z",
    "created_by_role": "PHASE_OWNER",
    "gated_category": "GC-05",
    "entity_type": null,
    "entity_id": null,
    "summary": "fixture-approval-summary-5: a structural placeholder for a one-sentence approval request that was never decided in time.",
    "effect_if_approved": "fixture-approval-effect-5: a structural placeholder for the concrete external-facing effect.",
    "reversal_cost": "fixture-approval-reversal-cost-5: a structural placeholder describing how hard this is to undo.",
    "artifact_digest": "fixture-artifact-digest-5",
    "requested_by_role": "PHASE_OWNER",
    "requested_at": "2026-06-01T09:00:00Z",
    "decided_by_role": "DETERMINISTIC_CODE",
    "decided_at": "2026-06-30T09:00:00Z"
  }
]
